reference,description,field-count,name,entry-date,start-date,end-date
tpo,Details of any Tree Preservation Orders (TPO) affecting the development site,2,Tree preservation order details,2025-06-30,,
discharge-con,How any conditions imposed as part of being given planning permission will be met,1,Discharge condition,2025-07-08,,
proposal-details,"What development, works or change of use is proposed",9,Description of the proposal,2025-06-12,,
info-support-ldc,Supporting information required to make a Lawful Development Certificate application,5,Information to support LDC,2025-07-15,,
waste-storage-collection,"Any waste storage or recycling arrangements are in place, such as waste storage areas",6,Waste storage and collection,2025-07-08,,
adj-premises,Details of properties next to the development site,1,Adjacent premises,2025-07-07,,
desc-proposed-works,Details of development plans such as extensions measurements or work specifications,4,Description of proposed works,2025-07-14,,
desc-existing-use,"How the development site is used, including use class information",1,Description of existing use,2025-07-09,,
grounds-ldc,Evidence and explanations relating to a Lawful Development Certificate (LDC) application,5,Grounds for lawful development certificate,2025-07-10,,
employment,How the proposed development will impact existing and proposed employee numbers,2,Employment,2025-07-08,,
desc-work-impacts-risks,"How the proposed development may affect nearby amenities, air traffic, defence assets or protected views.",6,Description of work impacts and risks,2025-07-14,,
processes-machinery-waste,How waste will be managed on the site,4,Processes machinery waste,2025-07-09,,
eligibility-current-building,How the current building meets eligibity criteria,4,Eligibility current building,2025-07-15,,
eligibility-proposal,How the proposed development meets eligibility criteria,13,Eligibility proposal,2025-07-18,,
demolition-reason,Why demolition is necessary at the development site,1,Demolition reason,2025-06-30,,
haz-substances,Details of hazardous substances requiring consent used as part of the development,4,Hazardous substances,2025-07-09,,
hedgerow-removal,Details of any hedgerows being removed as part of the development,6,Hedgerow removal notice,2025-07-17,,
grounds-existing-use,Supporting inforation for a Lawful Development Certificate application relating to how the site has most recently been used.,4,Grounds for application (information about the existing use(s)),2025-06-26,,
supporting-info,Any additional information which will help with the planning application,1,Supporting information,2025-06-26,,
trees-hedges,Details of trees and/or hedges that will be affected by the proposed development,6,Trees and hedges information,2025-06-12,,
proposed-advert-details,Details of the proposed advertisements such as their size and how they are made,1,Proposed advert details,2025-07-17,,
ldc-interest,Who had a say in whether the proposal should go ahead,3,LDC Interest,2025-01-17,,
grounds-proposed-use,What the new site will be used for,5,Grounds for proposed use,2025-07-17,,
advertisement-types,What type of advertisements are proposed and how many there will be.,2,Advertisement types,2025-07-08,,
eligibility,Whether certain eligibility criteria has been met and the right people notified,3,Eligibility,2025-07-18,,
lb-alter,Details of any changes being made to a listed building as part of development works,3,Listed building alterations,2025-07-08,,
proposal-details-inc-non-residential,Details of the residential and non-residential parts of the proposed development.,4,Description of the proposed development including any non-residential development,2025-06-26,,
dev-type,Supporting information for developments used for oil and gas exploration or mining ,9,Development type,2025-07-02,,
ownership-certs,"Who will be affected by the proposal and whether they have been notified, such as agricultural tenants",10,Ownership certificates and agricultural land declaration,2025-06-13,,
foul-sewage,How waste water will leave the property as part of the proposed development,6,Foul sewage disposal,2025-07-09,,
checklist,"Checking whether all the requirements of the form have been met, such as proof of payment or supporting documentation.",1,Checklist,2025-06-12,,
site-area,How big the site is including relevant measurements,2,Site area,2025-07-02,,
related-applications,Details of any other development proposals made for the site,2,Related applications,2025-07-08,,
desc-proposed-works-lb-ldc,Details of development plans for the work to the listed building an applicant is seeking a lawful development certificate for,1,Description of proposed works for listed building lawful development certificate,2025-11-24,,
trees-additional,Further details of any issues relating to trees on the site,5,Trees additional information,2025-07-01,,
grounds-for-application,Why a Certificate of Lawfulness of Propose Works is being requested.,2,Grounds for application,2025-07-16,,
immunity-from-listing,Whether the applicant has obtained a Certificate of Immunity (COI) meaning the building in question cannot be listed,2,Immunity from listing,2025-07-01,,
desc-your-proposal,Written description of the proposed development including any additional relevant details.,8,Description of your proposal,2025-06-26,,
trees-location,Where trees affected by the proposed development are located.,2,Trees location,2025-07-01,,
agent-details,Name and contact information if an agent is being used.,1,Agent details,2025-06-02,,
applicant-details,Name and contact information for the parties making the application.,1,Applicant details,2025-06-16,,
advert-location,Where the advertisement being applied to be built will be located,5,Advertisement location,2025-07-09,,
equip-method,How oil and gas will be extracted as part of the proposed development.,1,Equipment and method,2025-07-08,,
flood-risk-assessment,Results of any flood risk assessments made for the development site,6,Flood risk assessment,2025-07-17,,
nm-amendment-details,Details of changes being requested to plans after permission has already been granted.,4,Non-material amendment details,2025-07-15,,
community-consultation,What community consultation activities have taken place as part of the application,2,Community consultation,2025-07-08,,
interest-in-land,Whether the applicant owns or has permission to use the land where the proposed advertisement will be placed,3,Interest in land,2025-07-08,,
plans-drawings-supporting-materials,Additional materials and specifications that form part of the planning application,2,"Plans, drawings and supporting materials",2025-07-14,,
trees-ownership,Who owns any trees affected by the proposed development.,2,Trees ownership,2025-06-30,,
site-details,Where the proposed development will be built.,1,Site details,2025-06-13,,
existing-use,How the site is currently being used.,8,Existing use,2025-08-18,,
proposal-details-ldc,Details of why a Lawful Development Certificate is required.,7,Proposal details LDC,2025-07-17,,
eligibility-related-works,Whether any related works such as scaffolding required will affect the eligibility of the planning proposal,1,Eligibility related works,2025-07-18,,
res-units,Details of the residential units that make up both the current and proposed development.,5,Residential units,2025-07-17,,
demolition,Details of any demolition that needs to take place as part of the development proposal.,9,Demolition,2025-06-30,,
site-info,Any additional relevant information about the development site.,4,Site information,2025-06-26,,
processes-machinery-waste-outline,"If making an 'outline' application, how waste will be managed on the development site",4,Processes machinery waste,2025-07-14,,
use-works-activity,"Why a Lawful Development Certificate is required regarding how the development site is being used, or specific works taking place on the site.",3,Use works activity,2025-07-17,,
pre-app-advice,Details of pre-application advice previously received from the planning authority,5,Pre-application advice,2025-06-12,,
tree-work-details,Details of trees affected by the proposed development and what work is being done to them.,2,Identification of tree(s) and description of works,2025-06-30,,
eligibility-extension,How a proposal to build an extension meets relevant criteria.,7,Eligibility extension,2025-07-10,,
agent-contact,Name and contact information if an agent is being used.,2,Agent contact details,2025-05-30,,
vol-agreement,Details of any voluntary agreements made as part of an oil and gas extraction application.,2,Voluntary agreement,2025-06-26,,
designated-areas,"Details of any 'designated area' the develpoment site is on, such as a Conservation Area or National Park.",1,Designated areas,2025-01-02,,
applicant-contact,Telephone number and email address of the applicant.,2,Applicant contact details,2025-06-16,,
non-res-floorspace,Details of changes to non-residential floorspace in the proposed development.,6,Non residential floorspace,2025-07-17,,
access-rights-of-way,Details of any changes the proposed development would make to existing access arrangements or public rights of way,8,Access and rights of way,2025-06-13,,
hrs-operation,Proposed operating hours if the proposed development is intended for non-residential use.,2,Hours of operation,2025-07-16,,
bio-geo-arch-con,"Details of potential impacts to the biodiversity of the site, or any noteable archaeological or geological features.",4,"Biodiversity, geological and archaeological conservation",2025-07-08,,
materials,What materials are being used for the proposed development,3,Materials,2025-06-13,,
site-visit,Information to help the planning authority arrange a site visit,4,Site Visit Details,2025-06-12,,
advert-period,How long the proposed advertisement will be shown.,2,Advert period,2025-07-07,,
conflict-of-interest,Details of any conflict of interest that may exist between the applicant and planning authority.,3,Conflict of interest,2025-06-16,,
oilgas-permission-type,"Module for details about types of onshore oil and gas extraction permissions already received and applying for
",6,Oil and gas permission types,2025-09-09,,
bng,How any natural habitats on the development site will be improved by the proposed works.,4,Biodiversity net gain,2025-06-16,,
parking,Details of any changes the proposed development would make to parking facilities.,2,Parking arrangements,2025-06-12,,
vehicle-parking,Details of current parking facilities at the site and any changes that would be made by the proposed development.,1,Vehicle parking,2025-07-08,,
site-ownership,"For oil and gas extraction developments, who owns or has an interest in the site.",3,Site ownership,2025-07-09,,
storage-facilities,"For oil and gas extraction developments, how chemicals will be stored",1,Storage facilities,2025-07-08,,
trade-effluent,"Details of any liquid waste produced by industial processes on the proposed site, and how it will be diposed of.",2,Trade effluent,2025-06-26,,
interest-details,Names and contact details for all parties with an interest in the proposed develpoment.,3,Interest details,2025-07-18,,
declaration,Signed and dated verification of the application's accuracy.,3,Declaration,2025-06-12,,
lb-grade,The grade of any listed building affected by the proposed development.,3,Listed building grade,2025-01-05,,
part-discharge,Details of how the applicant is meeting a specific part of a set of conditions made by the planning authority.,2,Part discharge,2025-07-07,,
con-remove-vary,Why the applicant is asking for planning conditions to be removed or changed.,2,Condition removal or variation,2025-07-08,,
